{
  "pack_id": "manufacturing",
  "version": "1.0.0",
  "catalog_contract_version": "industry-knowledge-core-1.0.0",
  "label": "Manufacturing and Industrial B2B",
  "summary": "Foundation knowledge for manufacturers, OEMs and industrial suppliers covering capabilities, products, specifications, materials, certifications, quality, applications, RFQs, lead times and distribution.",
  "maturity": "foundation",
  "risk_level": "moderate_regulated",
  "aliases": [
    "manufacturing",
    "manufacturer",
    "industrial",
    "oem",
    "components",
    "supplier",
    "fabrication"
  ],
  "subindustries": [
    "contract manufacturing",
    "components",
    "machinery",
    "electronics manufacturing",
    "packaging",
    "metal fabrication",
    "textiles",
    "industrial distribution"
  ],
  "capability_ids": [
    "b2b_procurement",
    "lead_generation",
    "documents_compliance",
    "multi_location_network",
    "publishing",
    "regulated_claims"
  ],
  "classification_policy": {
    "classifier_version": "industry-role-classifier-1.0.0",
    "minimum_score": 6.0,
    "minimum_margin": 1.5,
    "high_confidence_score": 10.0,
    "maximum_secondary_roles": 2,
    "schema_only_may_classify": false,
    "negative_score_floor": -20.0,
    "abstain_on_tie": true,
    "maximum_evidence_records": 24,
    "maximum_alternatives": 5,
    "maximum_conflicts": 8
  },
  "page_roles": [
    {
      "role_id": "manufacturing.home",
      "label": "Manufacturing and Industrial B2B home",
      "description": "Industry role for manufacturing and industrial b2b home.",
      "page_kinds": [
        "identity"
      ],
      "default_disposition": "analyze",
      "temporal_policy": "current_required",
      "minimum_score": 3.0,
      "signals": [
        {
          "field": "title",
          "operator": "contains_any",
          "weight": 3.0,
          "values": [
            "manufacturer",
            "manufacturing",
            "industrial",
            "oem",
            "supplier"
          ],
          "signal_id": "manufacturing.home.positive_signal_1",
          "polarity": "positive"
        },
        {
          "field": "h1",
          "operator": "contains_any",
          "weight": 2.5,
          "values": [
            "manufacturer",
            "manufacturing",
            "industrial",
            "oem",
            "supplier"
          ],
          "signal_id": "manufacturing.home.positive_signal_2",
          "polarity": "positive"
        },
        {
          "field": "headings",
          "operator": "contains_any",
          "weight": 2.0,
          "values": [
            "manufacturer",
            "manufacturing",
            "industrial",
            "oem",
            "supplier"
          ],
          "signal_id": "manufacturing.home.positive_signal_3",
          "polarity": "positive"
        },
        {
          "field": "schema_types",
          "operator": "intersects",
          "weight": 2.0,
          "values": [
            "Organization",
            "Corporation",
            "WebSite"
          ],
          "signal_id": "manufacturing.home.positive_signal_4",
          "polarity": "positive"
        },
        {
          "field": "page_kind",
          "operator": "in",
          "weight": 1.5,
          "values": [
            "identity"
          ],
          "signal_id": "manufacturing.home.positive_signal_5",
          "polarity": "positive"
        }
      ],
      "negative_signals": [],
      "required_sections": [
        "identity",
        "offerings",
        "audiences",
        "proof",
        "locations",
        "primary_action"
      ],
      "recommended_sections": [],
      "required_question_ids": [
        "manufacturing.offerings",
        "manufacturing.audience"
      ],
      "entity_type_ids": [
        "manufacturing.organization",
        "manufacturing.offering"
      ],
      "schema_expectations": {
        "recommended_types": [
          "Organization",
          "Corporation",
          "WebSite"
        ],
        "visible_parity_required": true,
        "rich_result_guaranteed": false
      },
      "primary_ctas": [],
      "allow_secondary": true
    },
    {
      "role_id": "manufacturing.offering_listing",
      "label": "Industrial product, capability or service listing",
      "description": "Industry role for industrial product, capability or service listing.",
      "page_kinds": [
        "listing"
      ],
      "default_disposition": "analyze",
      "temporal_policy": "current_required",
      "minimum_score": 6.0,
      "signals": [
        {
          "field": "path",
          "operator": "regex",
          "weight": 5.0,
          "pattern": "^/(?:products|capabilities|industries|solutions)(?:/|$)",
          "signal_id": "manufacturing.offering_listing.positive_signal_1",
          "polarity": "positive"
        },
        {
          "field": "title",
          "operator": "contains_any",
          "weight": 3.0,
          "values": [
            "product",
            "component",
            "capability",
            "manufacturing",
            "fabrication"
          ],
          "signal_id": "manufacturing.offering_listing.positive_signal_2",
          "polarity": "positive"
        },
        {
          "field": "h1",
          "operator": "contains_any",
          "weight": 2.5,
          "values": [
            "product",
            "component",
            "capability",
            "manufacturing",
            "fabrication"
          ],
          "signal_id": "manufacturing.offering_listing.positive_signal_3",
          "polarity": "positive"
        },
        {
          "field": "headings",
          "operator": "contains_any",
          "weight": 2.0,
          "values": [
            "product",
            "component",
            "capability",
            "manufacturing",
            "fabrication"
          ],
          "signal_id": "manufacturing.offering_listing.positive_signal_4",
          "polarity": "positive"
        },
        {
          "field": "schema_types",
          "operator": "intersects",
          "weight": 2.0,
          "values": [
            "ItemList",
            "CollectionPage"
          ],
          "signal_id": "manufacturing.offering_listing.positive_signal_5",
          "polarity": "positive"
        },
        {
          "field": "page_kind",
          "operator": "in",
          "weight": 1.5,
          "values": [
            "listing"
          ],
          "signal_id": "manufacturing.offering_listing.positive_signal_6",
          "polarity": "positive"
        }
      ],
      "negative_signals": [],
      "required_sections": [
        "scope",
        "offering_set",
        "selection_help",
        "filters",
        "links"
      ],
      "recommended_sections": [],
      "required_question_ids": [
        "manufacturing.offerings",
        "manufacturing.selection"
      ],
      "entity_type_ids": [
        "manufacturing.organization",
        "manufacturing.offering"
      ],
      "schema_expectations": {
        "recommended_types": [
          "ItemList",
          "CollectionPage"
        ],
        "visible_parity_required": true,
        "rich_result_guaranteed": false
      },
      "primary_ctas": [],
      "allow_secondary": true
    },
    {
      "role_id": "manufacturing.offering_detail",
      "label": "Industrial product, capability or service detail",
      "description": "Industry role for industrial product, capability or service detail.",
      "page_kinds": [
        "detail",
        "conversion"
      ],
      "default_disposition": "analyze",
      "temporal_policy": "current_required",
      "minimum_score": 6.0,
      "signals": [
        {
          "field": "path",
          "operator": "regex",
          "weight": 5.0,
          "pattern": "^/(?:product|component|capability|service)(?:/|$)",
          "signal_id": "manufacturing.offering_detail.positive_signal_1",
          "polarity": "positive"
        },
        {
          "field": "title",
          "operator": "contains_any",
          "weight": 3.0,
          "values": [
            "product",
            "component",
            "capability",
            "manufacturing",
            "fabrication"
          ],
          "signal_id": "manufacturing.offering_detail.positive_signal_2",
          "polarity": "positive"
        },
        {
          "field": "h1",
          "operator": "contains_any",
          "weight": 2.5,
          "values": [
            "product",
            "component",
            "capability",
            "manufacturing",
            "fabrication"
          ],
          "signal_id": "manufacturing.offering_detail.positive_signal_3",
          "polarity": "positive"
        },
        {
          "field": "headings",
          "operator": "contains_any",
          "weight": 2.0,
          "values": [
            "product",
            "component",
            "capability",
            "manufacturing",
            "fabrication"
          ],
          "signal_id": "manufacturing.offering_detail.positive_signal_4",
          "polarity": "positive"
        },
        {
          "field": "body",
          "operator": "contains_any",
          "weight": 1.0,
          "values": [
            "features",
            "benefits",
            "requirements"
          ],
          "signal_id": "manufacturing.offering_detail.positive_signal_5",
          "polarity": "positive"
        },
        {
          "field": "schema_types",
          "operator": "intersects",
          "weight": 2.0,
          "values": [
            "Product",
            "Service"
          ],
          "signal_id": "manufacturing.offering_detail.positive_signal_6",
          "polarity": "positive"
        },
        {
          "field": "cta_text",
          "operator": "contains_any",
          "weight": 2.5,
          "values": [
            "request a quote",